{
  "schema_version": "1.0.0",
  "comparison_id": "DISCOVERY-COMPARISON-001",
  "brief": {
    "title": "Mobile co-op survival-builder",
    "platform_priority": ["iOS", "Android", "web-preview", "desktop-preview"],
    "description": "A mobile-first cooperative survival-builder requiring reusable foundations for movement, combat, NPC AI, building, inventory/crafting, saving, touch/accessibility, content, audio and networking."
  },
  "capabilities": [
    "whole-starter-architecture",
    "controller-camera",
    "combat-interactions",
    "enemy-npc-ai",
    "building-placement",
    "inventory-economy",
    "crafting-recipes",
    "save-progression",
    "ui-touch-accessibility",
    "environment-character-animation-assets",
    "audio-music",
    "multiplayer-networking-social"
  ],
  "interactive_baseline": {
    "mode": "interactive_manual_agent",
    "measurement_status": "action_counts_only",
    "search_actions": 17,
    "source_fetches": 21,
    "distinct_sources_inspected": 11,
    "candidate_count": 11,
    "reviewable_candidate_count": 1,
    "capability_candidate_coverage_pct": 92,
    "fully_cleared_capability_coverage_pct": 25,
    "irrelevant_or_duplicate_filtered": null,
    "human_interventions": 0,
    "unsafe_promotions": 0,
    "elapsed_minutes": null,
    "cost_status": "unknown",
    "cost_value_usd": null,
    "queue": [
      {
        "candidate_id": "canonical.reuse.kenney-starter-3d-platformer",
        "capabilities": ["controller-camera", "environment-character-animation-assets", "audio-music"],
        "repository": "KenneyNL/Starter-Kit-3D-Platformer",
        "revision": "3fa8a04b1c01ab23db43123d4ce814a34c3fc7f0",
        "stars": 1205,
        "forks": 175,
        "license_spdx": "MIT",
        "maintenance": "active",
        "screening_status": "reviewable",
        "asset_boundary": "cleared",
        "dependency_boundary": "cleared",
        "reason": "Inherited canonical source: MIT code plus explicitly CC0 bundled sprites/models/SFX and cleared dependency boundary. Useful controller/content foundation, but not treated as a complete survival-game starter."
      },
      {
        "candidate_id": "canonical.reuse.limboai",
        "capabilities": ["enemy-npc-ai"],
        "repository": "limbonaut/limboai",
        "revision": "a6f5c7fc11ff80d512dd75c82cfa85724fd8a742",
        "stars": 2965,
        "forks": 139,
        "license_spdx": "MIT",
        "maintenance": "active",
        "screening_status": "needs_deeper_review",
        "asset_boundary": "requires_review",
        "dependency_boundary": "requires_review",
        "reason": "Strong behavior-tree/state-machine fit from the canonical external registry, but demo/content and dependency boundaries remain review-required."
      },
      {
        "candidate_id": "github.gdquest-third-person-controller",
        "capabilities": ["controller-camera", "combat-interactions"],
        "repository": "gdquest-demos/godot-4-3d-third-person-controller",
        "revision": "b3bd6e81084f568be8aa44a69a0c2b1e52e806b3",
        "stars": 1011,
        "forks": 131,
        "license_spdx": "MIT",
        "maintenance": "active",
        "screening_status": "needs_deeper_review",
        "asset_boundary": "separate_or_replace",
        "dependency_boundary": "requires_review",
        "reason": "High-fit active TPS controller. Exact licence file separates MIT source/scene/shader code from CC-BY-NC-SA art, so only the code layer may proceed toward commercial review after asset separation."
      },
      {
        "candidate_id": "github.gloot",
        "capabilities": ["inventory-economy"],
        "repository": "peter-kish/gloot",
        "revision": "6b09b87ac07a8536779ef1ab0fafc7e99830f948",
        "stars": 961,
        "forks": 43,
        "license_spdx": "MIT",
        "maintenance": "active",
        "screening_status": "needs_deeper_review",
        "asset_boundary": "not_applicable",
        "dependency_boundary": "requires_review",
        "reason": "Current, popular universal Godot inventory system under MIT. Dependency/version/runtime fit still requires canonical screening before production selection."
      },
      {
        "candidate_id": "github.netfox",
        "capabilities": ["multiplayer-networking-social"],
        "repository": "foxssake/netfox",
        "revision": "1e7281de3e48f797287813b83f731a01e05775f8",
        "stars": 1073,
        "forks": 82,
        "license_spdx": "MIT",
        "maintenance": "active",
        "screening_status": "needs_deeper_review",
        "asset_boundary": "not_applicable",
        "dependency_boundary": "requires_review",
        "reason": "Active Godot multiplayer/netcode addons with strong adoption signal; production fit, dependencies and mobile/network behavior remain execution/review work."
      },
      {
        "candidate_id": "github.markodm-building-system",
        "capabilities": ["building-placement"],
        "repository": "MarkoDM/GodotInGameBuildingSystem",
        "revision": "f24b0cfd95bcf84d06c773c7930af953b05f1696",
        "stars": 89,
        "forks": 14,
        "license_spdx": "MIT",
        "maintenance": "stale",
        "screening_status": "needs_deeper_review",
        "asset_boundary": "requires_review",
        "dependency_boundary": "requires_review",
        "reason": "Directly relevant building starter and a good low-star/high-fit discovery, but last source push was in 2024; maintenance and bundled-content boundaries require review."
      },
      {
        "candidate_id": "github.vault-save-system",
        "capabilities": ["save-progression"],
        "repository": "sempitern0/Vault",
        "revision": "fbf19ca9f901eb4e5a855680d4772ea1bb30836f",
        "stars": 12,
        "forks": 0,
        "license_spdx": "MIT",
        "maintenance": "stable",
        "screening_status": "needs_deeper_review",
        "asset_boundary": "not_applicable",
        "dependency_boundary": "requires_review",
        "reason": "Focused low-star MIT Godot save-system candidate. Small surface is attractive, but runtime/version/dependency validation remains necessary."
      },
      {
        "candidate_id": "github.virtual-joystick",
        "capabilities": ["ui-touch-accessibility"],
        "repository": "AdamJStankiewicz/VirtualJoystick",
        "revision": "23346ff2404aefdd605f818b1dcb281f0efefa7a",
        "stars": 17,
        "forks": 4,
        "license_spdx": null,
        "maintenance": "stale",
        "screening_status": "blocked_license",
        "asset_boundary": "unknown",
        "dependency_boundary": "unknown",
        "reason": "Direct mobile-joystick fit but GitHub exposes no repository licence and source has not moved since 2023; cannot become a production component without explicit licence/provenance review."
      },
      {
        "candidate_id": "github.gato-accessibility",
        "capabilities": ["ui-touch-accessibility"],
        "repository": "Nokorpo/gato-godot-accessibility-toolkit",
        "revision": "5180a1ed0acd9cedd0de25f297b46e2c6f8154f5",
        "stars": 10,
        "forks": 2,
        "license_spdx": "MPL-2.0",
        "maintenance": "active",
        "screening_status": "needs_deeper_review",
        "asset_boundary": "requires_review",
        "dependency_boundary": "requires_review",
        "reason": "Current accessibility toolkit with excellent task fit. MPL-2.0/file-level obligations and bundled demos/dependencies require explicit integration-boundary review."
      },
      {
        "candidate_id": "github.godot-crafting",
        "capabilities": ["crafting-recipes"],
        "repository": "AdamJStankiewicz/GodotCrafting",
        "revision": "8c39104dabbf1622f6c28b00bd1e5c6c89748086",
        "stars": 2,
        "forks": 1,
        "license_spdx": null,
        "maintenance": "stale",
        "screening_status": "blocked_license",
        "asset_boundary": "unknown",
        "dependency_boundary": "unknown",
        "reason": "Direct crafting-system match, but repository is stale and has no declared licence metadata; retained as a blocked lead rather than a production candidate."
      },
      {
        "candidate_id": "github.expressobits-inventory",
        "capabilities": ["inventory-economy"],
        "repository": "expressobits/inventory-system",
        "revision": "f716e2c1d762988ca37bdc92a2fdc4df29a7835c",
        "stars": 726,
        "forks": 60,
        "license_spdx": "MIT",
        "maintenance": "stable",
        "screening_status": "needs_deeper_review",
        "asset_boundary": "not_applicable",
        "dependency_boundary": "requires_review",
        "reason": "Second strong inventory candidate with multiplayer-oriented design. Exact revision was pinned in the final provenance-correction fetch; dependency and runtime boundaries remain review-required."
      }
    ],
    "notes": "Action-count instrumentation is reliable: 17 explicit searches and 21 verification fetches, including the final provenance-correction fetch for expressobits/inventory-system. Wall-clock timing and monetary cost were not reliably instrumented, so they remain unknown. The baseline deliberately preserves blocked/stale/no-licence candidates instead of inflating eligible coverage."
  },
  "bounded_worker": {
    "mode": "bounded_discovery_worker",
    "measurement_status": "pending",
    "search_actions": null,
    "source_fetches": null,
    "distinct_sources_inspected": null,
    "candidate_count": null,
    "reviewable_candidate_count": null,
    "capability_candidate_coverage_pct": null,
    "fully_cleared_capability_coverage_pct": null,
    "irrelevant_or_duplicate_filtered": null,
    "human_interventions": null,
    "unsafe_promotions": null,
    "elapsed_minutes": null,
    "cost_status": "pending",
    "cost_value_usd": null,
    "queue": [],
    "notes": "Pending live execution of tools/bounded-external-discovery.mjs."
  },
  "decision": {
    "status": "PENDING_COMPARISON",